{"id":"SRC-0197","source_type":"manual","title":"rpc(5) — RPC program number database","authors_or_bodies":["Sun RPC Source distribution","OpenBSD Project"],"date":{"value":"2010-09-01","precision":"day","certainty":"confirmed","notes":"manual revision containing historical Sun RPC example"},"edition_or_revision":"OpenBSD rpc(5)","identifiers":[],"publisher_or_issuer":"OpenBSD Project","language":["en"],"topics":["/etc/rpc","Sun RPC","RPC program numbers","portmapper","NFS","NIS"],"artifact_ids":["ART-0197"],"access":{"canonical_url":"https://man.openbsd.org/rpc.5","archive_urls":[],"catalog_urls":[],"local_mirror":null,"accessed_on":"2026-08-29","availability":"open"},"rights_status":"open-license","evidence_grade":"primary-retrospective","research_state":"mined","claims_extracted":[{"claim":"/etc/rpc maps RPC program names to program numbers and aliases; the manual preserves an example directly identified as coming from the Sun RPC Source distribution, including portmapper=100000 and nfs=100003.","locator":"DESCRIPTION and EXAMPLES","certainty":"confirmed","artifact_ids":["ART-0197"],"notes":null}],"conflicts":[],"notes":"RPC program numbers are not TCP/UDP service port numbers; portmapper/rpcbind mediates program/version/protocol to transport endpoints.","last_reviewed":"2026-08-29"}