{"id":"SRC-0195","source_type":"manual","title":"networks(5) — network name data base","authors_or_bodies":["Berkeley Software Distribution","FreeBSD manpage archive"],"date":{"value":"1991-05-10","precision":"day","certainty":"confirmed","notes":"4.3BSD NET/2 manual revision; HISTORY traces format to 4.2BSD"},"edition_or_revision":"4.3BSD NET/2 manual page","identifiers":[],"publisher_or_issuer":"BSD / FreeBSD manual archive","language":["en"],"topics":["/etc/networks","NIC network database","network names","4.2BSD"],"artifact_ids":["ART-0195"],"access":{"canonical_url":"https://man.freebsd.org/cgi/man.cgi?query=networks&sektion=5&manpath=4.3BSD+NET%2f2","archive_urls":[],"catalog_urls":[],"local_mirror":null,"accessed_on":"2026-08-29","availability":"open"},"rights_status":"copyrighted-link-only","evidence_grade":"primary-contemporary","research_state":"mined","claims_extracted":[{"claim":"The networks database stores official network names, network numbers and aliases; it was normally built from the official NIC database with local modifications possible, and its file format appeared in 4.2BSD.","locator":"DESCRIPTION and HISTORY","certainty":"confirmed","artifact_ids":["ART-0195"],"notes":null}],"conflicts":[],"notes":null,"last_reviewed":"2026-08-29"}