{"id":"SRC-0204","source_type":"rfc","title":"Basic Socket Interface Extensions for IPv6","authors_or_bodies":["Robert Gilligan","Susan Thomson","Jim Bound","W. Richard Stevens","Thomas Narten"],"date":{"value":"2003-02","precision":"month","certainty":"confirmed","notes":null},"edition_or_revision":"RFC 3493","identifiers":[{"scheme":"RFC","value":"3493"}],"publisher_or_issuer":"RFC Editor","language":["en"],"topics":["getaddrinfo","getnameinfo","IPv6","socket API"],"artifact_ids":["ART-0201"],"access":{"canonical_url":"https://www.rfc-editor.org/info/rfc3493/","archive_urls":[],"catalog_urls":[],"local_mirror":null,"accessed_on":"2026-08-29","availability":"open"},"rights_status":"rfc-distribution-terms","evidence_grade":"primary-contemporary","research_state":"mined","claims_extracted":[{"claim":"RFC 3493 is the later Basic Socket Interface Extensions for IPv6 specification and obsoletes RFC 2553.","locator":"RFC metadata and Sections 6.1-6.2","certainty":"confirmed","artifact_ids":["ART-0201"],"notes":null}],"conflicts":[],"notes":"Later standards anchor for the getaddrinfo/getnameinfo API generation.","last_reviewed":"2026-08-29"}