{
  "id":"SRC-0149","source_type":"rfc","title":"Updated Specification of the IPv4 ID Field","authors_or_bodies":["J. Touch"],"date":{"value":"2013-02","precision":"month","certainty":"confirmed","notes":null},"edition_or_revision":"RFC 6864","identifiers":[{"scheme":"RFC","value":"6864"}],"publisher_or_issuer":"RFC Editor / IETF","language":["en"],"topics":["IPv4","Identification field","fragmentation","atomic datagrams"],"artifact_ids":["ART-0160"],"access":{"canonical_url":"https://www.rfc-editor.org/info/rfc6864","archive_urls":[],"catalog_urls":[],"local_mirror":null,"accessed_on":"2026-08-29","availability":"open"},"rights_status":"rfc-distribution-terms","evidence_grade":"primary-contemporary","research_state":"mined","claims_extracted":[{"claim":"RFC 6864 updates RFC 791/1122/2003 so the IPv4 Identification field is meaningful primarily for fragmentation/reassembly rather than all datagrams.","locator":"Abstract; Sections 3-4","certainty":"confirmed","artifact_ids":["ART-0160"],"notes":null}],"conflicts":[],"notes":"Canonical semantic-drift source for a field whose wire position survived.","last_reviewed":"2026-08-29"
}