{"id":"SRC-0223","source_type":"web-page","title":"ip-link(8) — Linux manual page","authors_or_bodies":["iproute2 project"],"topics":["ip link","rtnetlink","link objects"],"artifact_ids":["ART-0215","ART-0216"],"access":{"canonical_url":"https://man7.org/linux/man-pages/man8/ip-link.8.html","archive_urls":[],"catalog_urls":[],"local_mirror":null,"accessed_on":"2026-08-29","availability":"open"},"rights_status":"copyrighted-link-only","evidence_grade":"primary-contemporary","research_state":"mined","claims_extracted":[{"claim":"ip link is the iproute2 interface for link-device objects.","locator":"NAME/SYNOPSIS","certainty":"confirmed","artifact_ids":["ART-0216"],"notes":null}],"conflicts":[],"notes":null,"last_reviewed":"2026-08-29"}