{"id":"SRC-0242","source_type":"archive-catalog","title":"Archived ftp.inr.ac.ru ip-routing directory index","authors_or_bodies":["Institute for Nuclear Research archive mirror","FUNET mirror"],"date":{"value":"1999-2001","precision":"range","certainty":"confirmed","notes":"Visible surviving iproute2 snapshot dates in the mirrored directory."},"edition_or_revision":null,"identifiers":[],"publisher_or_issuer":"FUNET archived mirror","language":["en"],"topics":["iproute2","source tarballs","release snapshots","Alexey Kuznetsov"],"artifact_ids":["ART-0228"],"access":{"canonical_url":"https://ftp.funet.fi/pub/mirrors/Archived/ftp.inr.ac.ru/ip-routing/","archive_urls":[],"catalog_urls":[],"local_mirror":null,"accessed_on":"2026-08-29","availability":"open"},"rights_status":"unknown","evidence_grade":"primary-contemporary","research_state":"mined","claims_extracted":[{"claim":"The surviving INR mirror contains date-stamped iproute2 snapshot tarballs beginning at least with the 1999 2.2.4-now-ss series and continuing through later snapshots.","locator":"directory listing","certainty":"confirmed","artifact_ids":["ART-0228"],"notes":"This does not prove the first public iproute release."}],"conflicts":[],"notes":"Archive-survival evidence; exact earliest public release remains an open question.","last_reviewed":"2026-08-29"}