{"id":"SRC-0176","source_type":"rfc","title":"Autonomous System (AS) Number Reservation for Documentation Use","authors_or_bodies":["Geoff Huston"],"date":{"value":"2008-12","precision":"month","certainty":"confirmed","notes":null},"edition_or_revision":"RFC 5398","identifiers":[{"scheme":"RFC","value":"5398"}],"publisher_or_issuer":"RFC Editor","language":["en"],"topics":["documentation ASN","examples","special-use numbers"],"artifact_ids":["ART-0179"],"access":{"canonical_url":"https://www.rfc-editor.org/info/rfc5398/","archive_urls":[],"catalog_urls":[],"local_mirror":null,"accessed_on":"2026-08-29","availability":"open"},"rights_status":"rfc-distribution-terms","evidence_grade":"primary-contemporary","research_state":"mined","claims_extracted":[{"claim":"Two ASN blocks are reserved for documentation and examples, including a block above the 16-bit boundary.","locator":"Abstract and Section 2","certainty":"confirmed","artifact_ids":["ART-0179"],"notes":null}],"conflicts":[],"notes":null,"last_reviewed":"2026-08-29"}