{"id":"SRC-0229","source_type":"rfc","title":"TCP Congestion Control","authors_or_bodies":["IETF"],"edition_or_revision":"RFC 5681","identifiers":[{"scheme":"RFC","value":"5681"}],"topics":["TCP","slow start","congestion avoidance","cwnd","ssthresh"],"artifact_ids":["ART-0219"],"access":{"canonical_url":"https://www.rfc-editor.org/info/rfc5681/","archive_urls":[],"catalog_urls":[],"local_mirror":null,"accessed_on":"2026-08-29","availability":"open"},"rights_status":"rfc-distribution-terms","evidence_grade":"primary-contemporary","research_state":"mined","claims_extracted":[],"conflicts":[],"notes":"Used to distinguish standardized congestion-control concepts from Linux diagnostic representation.","last_reviewed":"2026-08-29"}