{"id":"SRC-0232","source_type":"web-page","title":"ip-neighbour(8) — Linux manual page","authors_or_bodies":["iproute2 project"],"topics":["ip neigh","ARP table","IPv6 neighbours","NUD"],"artifact_ids":["ART-0221"],"access":{"canonical_url":"https://man7.org/linux/man-pages/man8/ip-neighbour.8.html","archive_urls":[],"catalog_urls":[],"local_mirror":null,"accessed_on":"2026-08-29","availability":"open"},"rights_status":"copyrighted-link-only","evidence_grade":"primary-contemporary","research_state":"mined","claims_extracted":[],"conflicts":[],"notes":null,"last_reviewed":"2026-08-29"}