{
  "id":"SRC-0102","source_type":"rfc","title":"Nonstandard for transmission of IP datagrams over serial lines: SLIP","authors_or_bodies":["J. L. Romkey"],
  "date":{"value":"1988-06","precision":"month","certainty":"confirmed","notes":null},"edition_or_revision":"RFC 1055","identifiers":[{"scheme":"RFC","value":"1055"}],"publisher_or_issuer":"Network Working Group / RFC Editor archival corpus","language":["en"],"topics":["SLIP","serial lines","IP framing","dial-up"],"artifact_ids":["ART-0119"],
  "access":{"canonical_url":"https://www.rfc-editor.org/rfc/rfc1055.html","archive_urls":[],"catalog_urls":["https://www.rfc-editor.org/info/rfc1055"],"local_mirror":null,"accessed_on":"2026-08-29","availability":"open"},
  "fixity":{"sha256":null,"byte_size":null,"mime_type":"text/html","page_count":null,"ocr_status":"not-applicable","scan_notes":null},"rights_status":"rfc-distribution-terms","redistribution_notes":"Prefer canonical RFC Editor copies.","provenance":{"original_holder":"Network Working Group publication stream","current_holder":"RFC Editor archival corpus","donor_or_collection":null,"chain_notes":null},"evidence_grade":"primary-contemporary","research_state":"mined",
  "claims_extracted":[{"claim":"SLIP is documented as a nonstandard method for carrying IP datagrams over serial lines.","locator":"Title and Introduction","certainty":"confirmed","artifact_ids":["ART-0119"],"notes":null}],"conflicts":[],"notes":"Primary source for SLIP's deliberately minimal IP-over-serial role; PPP is not a formal RFC revision of SLIP.","last_reviewed":"2026-08-29"
}