{"id":"SRC-0190","source_type":"source-code","title":"Linux UAPI include/uapi/linux/if_ether.h","authors_or_bodies":["Linux kernel contributors"],"date":{"value":"2026-08-29","precision":"day","certainty":"confirmed","notes":"current source snapshot"},"edition_or_revision":"Linux master snapshot","identifiers":[],"publisher_or_issuer":"Linux kernel project","language":["en"],"topics":["ETH_P_IP","ETH_P_ARP","ETH_P_IPV6","EtherType constants","struct ethhdr"],"artifact_ids":["ART-0190"],"access":{"canonical_url":"https://github.com/torvalds/linux/blob/master/include/uapi/linux/if_ether.h","archive_urls":[],"catalog_urls":[],"local_mirror":null,"accessed_on":"2026-08-29","availability":"open"},"rights_status":"open-license","evidence_grade":"primary-contemporary","research_state":"mined","claims_extracted":[{"claim":"Linux UAPI exposes Ethernet protocol constants including PUP, IPv4, X.25, ARP, RARP and IPv6 and defines the Ethernet header type field used for packet classification.","locator":"ETH_P_* definitions and struct ethhdr","certainty":"confirmed","artifact_ids":["ART-0190"],"notes":"Individual constants still require registry provenance classification."}],"conflicts":[],"notes":"Source header also preserves early Linux INET provenance comments.","last_reviewed":"2026-08-29"}