{"id":"SRC-0253","source_type":"source-code","title":"Linux commit df3271f — BIC: CUBIC window growth (2.0)","authors_or_bodies":["Stephen Hemminger","David S. Miller"],"date":{"value":"2006-01-03","precision":"day","certainty":"confirmed","notes":"Commit date; author date 2005-12-14."},"edition_or_revision":"df3271f3361b61ce02da0026b4a53e63bc2720cb","identifiers":[{"scheme":"git","value":"df3271f3361b61ce02da0026b4a53e63bc2720cb"}],"publisher_or_issuer":"Linux kernel source tree","language":["en"],"topics":["BIC","CUBIC","window growth","Linux"],"artifact_ids":["ART-0239","ART-0240"],"access":{"canonical_url":"https://github.com/torvalds/linux/commit/df3271f3361b61ce02da0026b4a53e63bc2720cb","archive_urls":[],"catalog_urls":[],"local_mirror":null,"accessed_on":"2026-08-29","availability":"open"},"rights_status":"open-license","evidence_grade":"primary-contemporary","research_state":"verified","claims_extracted":[{"claim":"The commit explicitly replaces existing BIC version 1.1 with version 2.0 whose main change is the cubic window-growth function.","locator":"commit message and tcp_cubic.c diff","certainty":"confirmed","artifact_ids":["ART-0239","ART-0240"],"notes":null}],"conflicts":[],"notes":"Direct code-lineage evidence for BIC→CUBIC.","last_reviewed":"2026-08-29"}