{"id":"SRC-0270","source_type":"source-code","title":"Linux v2.6.24 drivers/net/veth.c","authors_or_bodies":["Pavel Emelianov"],"date":{"value":"2008-01-24","precision":"day","certainty":"confirmed","notes":"Linux 2.6.24 stable-release date; this record points to the source file at that release tag."},"edition_or_revision":"Linux v2.6.24","identifiers":[{"scheme":"git-tag","value":"v2.6.24"}],"publisher_or_issuer":"Linux kernel source tree","language":["en"],"topics":["veth","Linux 2.6.24","virtual Ethernet","OpenVZ","SWsoft"],"artifact_ids":["ART-0249"],"access":{"canonical_url":"https://github.com/torvalds/linux/blob/v2.6.24/drivers/net/veth.c","archive_urls":[],"catalog_urls":[],"local_mirror":null,"accessed_on":"2026-09-01","availability":"open"},"rights_status":"open-license","evidence_grade":"primary-contemporary","research_state":"verified","claims_extracted":[{"claim":"Linux v2.6.24 contains drivers/net/veth.c; its header carries 2007 OpenVZ/SWsoft Inc copyright, names Pavel Emelianov as author, and the source identifies driver version 1.0.","locator":"drivers/net/veth.c file header and DRV_VERSION definition","certainty":"confirmed","artifact_ids":["ART-0249"],"notes":"The same path was checked directly at tag v2.6.23 and was absent; the adjacent-tag observation is documented in the batch narrative."}],"conflicts":[],"notes":"The release snapshot establishes presence in v2.6.24. Copyright/affiliation is provenance evidence but does not by itself establish derivation from any specific earlier OpenVZ implementation.","last_reviewed":"2026-09-01"}