{"id":"SRC-0182","source_type":"rfc","title":"IANA-Reserved IPv4 Prefix for Shared Address Space","authors_or_bodies":["Jason Weil","Victor Kuarsingh","Carlos Donley","Chris Liljenstolpe","Marcel Azinger"],"date":{"value":"2012-04","precision":"month","certainty":"confirmed","notes":null},"edition_or_revision":"RFC 6598 / BCP 153","identifiers":[{"scheme":"RFC","value":"6598"}],"publisher_or_issuer":"RFC Editor","language":["en"],"topics":["100.64/10","Shared Address Space","CGN","CPE"],"artifact_ids":["ART-0185"],"access":{"canonical_url":"https://www.rfc-editor.org/info/rfc6598/","archive_urls":[],"catalog_urls":[],"local_mirror":null,"accessed_on":"2026-08-29","availability":"open"},"rights_status":"rfc-distribution-terms","evidence_grade":"primary-contemporary","research_state":"mined","claims_extracted":[{"claim":"100.64.0.0/10 is Shared Address Space for Service Provider CGN-to-CPE use and is explicitly distinct from RFC 1918 private address space.","locator":"Abstract and Section 1","certainty":"confirmed","artifact_ids":["ART-0185"],"notes":null}],"conflicts":[],"notes":null,"last_reviewed":"2026-08-29"}