{
  "id": "SRC-0072",
  "source_type": "rfc",
  "title": "Classless Inter-Domain Routing (CIDR): an Address Assignment and Aggregation Strategy",
  "authors_or_bodies": ["Vince Fuller", "Tony Li", "Jessica Yu", "Kannan Varadhan"],
  "date": {"value": "1993-09", "precision": "month", "certainty": "confirmed", "notes": null},
  "edition_or_revision": "RFC 1519",
  "identifiers": [{"scheme": "RFC", "value": "1519"}],
  "publisher_or_issuer": "IETF / RFC archival corpus",
  "language": ["en"],
  "topics": ["CIDR", "classless routing", "route aggregation", "address allocation", "longest match", "routing table growth"],
  "artifact_ids": ["ART-0097"],
  "access": {
    "canonical_url": "https://www.rfc-editor.org/rfc/rfc1519.html",
    "archive_urls": [],
    "catalog_urls": ["https://www.rfc-editor.org/info/rfc1519"],
    "local_mirror": null,
    "accessed_on": "2026-08-28",
    "availability": "open"
  },
  "fixity": {"sha256": null, "byte_size": null, "mime_type": "text/html", "page_count": null, "ocr_status": "not-applicable", "scan_notes": null},
  "rights_status": "rfc-distribution-terms",
  "redistribution_notes": "Prefer canonical RFC Editor copies.",
  "provenance": {"original_holder": "IETF CIDR/interdomain-routing work", "current_holder": "RFC Editor archival corpus", "donor_or_collection": null, "chain_notes": null},
  "evidence_grade": "primary-contemporary",
  "research_state": "mined",
  "claims_extracted": [
    {
      "claim": "CIDR was motivated by address-space pressure and explosive growth in routing tables.",
      "locator": "RFC 1519, Abstract and Section 1",
      "certainty": "confirmed",
      "artifact_ids": ["ART-0097"],
      "notes": "Context for why classless interdomain routing became necessary."
    },
    {
      "claim": "CIDR requires routing destinations to be represented by arbitrary network-and-mask pairs rather than class A/B/C semantics, with longest-match forwarding semantics.",
      "locator": "RFC 1519, Section 4.1",
      "certainty": "confirmed",
      "artifact_ids": ["ART-0097"],
      "notes": null
    },
    {
      "claim": "CIDR requires interdomain routing protocols to support route aggregation.",
      "locator": "RFC 1519, Sections 3.3 and 4.1-4.4",
      "certainty": "confirmed",
      "artifact_ids": ["ART-0097"],
      "notes": "Connect to BGP-4 without treating CIDR as a feature invented solely inside BGP."
    }
  ],
  "conflicts": [],
  "notes": "Use alongside BGP-4 specifications to preserve the separate address-allocation/routing-scaling lineage that drove classless protocol changes.",
  "last_reviewed": "2026-08-28"
}